234,System Administrator (On-Premise Virtualization),"VMware ESXi/Hyper-V, SAN/NAS Storage, High Availability setup, Backup solutions (Veeam)",On-site,5-9,"100,000 - 190,000",Maintaining local data center infrastructure.,2015-2020
235,IT Consultant (Strategy & Architecture),"Enterprise Architecture (TOGAF), Technology Roadmapping, Feasibility Studies, CxO interaction",On-site/Hybrid,10+,"200,000 - 400,000+",High-level advisory role for major digital transformation.,2017-Present
236,AI/ML Platform Engineer,"Building internal platforms for ML experimentation and model serving, Docker, Kubernetes, Python",Remote,4-7,"110,000 - 220,000",Focus on empowering internal Data Science teams.,2022-Present
237,Cyber Threat Hunter,"EDR/SIEM analysis, analyzing malicious code, APT tracking, incident response (proactive)",Hybrid,5-8,"130,000 - 250,000","Advanced security role, requires deep forensics knowledge.",2022-Present
238,Full-Stack Developer (Django/React),"Python/Django, React, Redux, PostgreSQL, API development",Remote/Hybrid,3-6,"70,000 - 130,000",Popular stack for web applications and startups.,2018-Present
239,Senior Technical Support Engineer (L3),"Resolving highly complex, escalated issues, code-level debugging, reproducing environment failures",Remote,6+,"110,000 - 200,000",Requires developer-level skills in troubleshooting.,2019-Present
240,Business Continuity Analyst,"Analyzing business processes, identifying critical functions, developing recovery strategies, testing plans",On-site/Hybrid,4-7,"80,000 - 150,000",Focus on organizational resilience and risk management.,2018-Present
241,RPA Technical Lead,"Designing complex RPA solutions, code review, mentoring junior RPA developers, platform administration",Hybrid,5-8,"120,000 - 230,000",Leading the automation pipeline in large enterprises.,2021-Present
242,Sales Engineer (Cybersecurity),"Presenting security solutions (Firewalls, EDR), PoC execution, technical requirements gathering",On-site/Hybrid,4-7,"90,000 - 180,000 (Plus Bonus)",Requires both sales acumen and deep security product knowledge.,2020-Present
243,Data Analyst (HR/People Analytics),"HRIS data reporting, trend analysis (turnover, hiring), data visualization (Power BI/Tableau)",On-site/Hybrid,2-4,"50,000 - 90,000",Growth area in large local conglomerates and MNCs.,2019-Present
244,"Legacy ERP Technical Consultant (e.g., Baan/BPCS)","Maintenance, reporting, and customization of very old or niche ERP systems",On-site,8+,"130,000 - 250,000",Rare but high-pay niche for maintaining vital legacy infrastructure.,2015-2018
245,Cloud Architect (Serverless/Function-as-a-Service),"AWS Lambda/Azure Functions/GCP Cloud Functions, API Gateway, Cost-efficient design",Remote,5-8,"130,000 - 260,000","Focus on building scalable, pay-per-use applications.",2021-Present
246,IT Project Manager (Telecom),"Managing core network projects, vendor delivery, regulatory approvals, site coordination",On-site,7+,"150,000 - 300,000",Specialized PM role in Mobile Network Operators.,2015-Present
247,Junior Blockchain Developer (EVM),"Solidity (basic), Truffle/Hardhat, basic dApp frontend (React), Metamask integration",Remote,1-3,"60,000 - 110,000",Entry-level role in the fast-growing Web3/crypto space.,2022-Present
248,Full-Stack Developer (Java/Spring Boot/React),"Java, Spring Boot, Microservices, React, API Security, Docker",Remote/Hybrid,4-7,"100,000 - 200,000","Classic enterprise stack, still dominant in large-scale systems.",2018-Present
249,UX/Design System Manager,"Managing and evolving the centralized design system (Figma), component versioning, governance",Remote/Hybrid,6+,"110,000 - 220,000",Focus on maintaining efficiency and brand consistency across products.,2022-Present
250,Academic R&D Project Manager (ICT),"Managing grant proposals, coordinating research teams (University/Industry), publication strategy",On-site/Hybrid,6+,"100,000 - 180,000",Focus on leveraging government/foreign research grants.,2016-Present
251,Principal Engineer / Fellow,"Deep expertise in system scaling, Patent/Research contribution, Mentorship, Cross-functional leadership",On-site/Hybrid,12+,"300,000 - 600,000+","Highest technical rank, focus on long-term technological vision.",2020-Present
252,Full-Stack Developer (Svelte/SvelteKit),"Svelte, JavaScript/TypeScript, Node.js, API Integration, Performance Optimization",Remote,3-6,"80,000 - 150,000","Emerging frontend framework, popular in modern startups.",2023-Present
253,Data Analyst (Supply Chain/Logistics),"SQL, Excel (Advanced), Inventory Optimization, Forecasting, Logistics Software knowledge",On-site/Hybrid,3-5,"60,000 - 110,000","High demand in manufacturing, e-commerce, and import/export tech.",2018-Present
254,Hardware Engineer (PC/Server Assembly),"Component knowledge (CPU, GPU, RAM), Troubleshooting, BIOS configuration, Cable management",On-site,1-3,"25,000 - 45,000","Local computer shops, small IT support firms (Legacy role).",2015-2018
255,Cloud Architect (Multi-Cloud Strategy),"AWS, Azure, GCP core services, Hybrid Cloud integration, Vendor negotiation",Remote/Hybrid,8+,"200,000 - 400,000+",Strategic role defining cloud usage across an enterprise.,2022-Present
256,IT Project Manager (Agile/Scrum),"Certified Scrum Master (CSM), Iteration Planning, Conflict Resolution, Velocity Tracking",Hybrid/Remote,5-8,"100,000 - 200,000",Focus on delivering software using Agile practices.,2018-Present
257,Junior Android Developer (Java),"Java (Legacy), Android Studio, Basic SDK knowledge, UI implementation",On-site,1-2,"30,000 - 50,000",Maintenance of older apps or entry-level training position.,2015-2018
258,"IT Security Governance, Risk & Compliance (GRC) Analyst","ISO 27001, NIST, COBIT, Policy Auditing, Risk Register Maintenance",On-site/Hybrid,3-6,"80,000 - 150,000",Focus on formal compliance and regulatory adherence.,2020-Present
259,Web Designer (Basic Freelance),"Photoshop/Illustrator, basic HTML/CSS, client communication, quick mockups",Remote,1-3,"20,000 - 40,000","Low-budget client work, common in small agencies.",2015-2017
260,Business Analyst (Retail Tech),"Point of Sale (POS) systems, Inventory management, Customer Loyalty programs, process mapping",On-site/Hybrid,4-7,"75,000 - 140,000",Growth area driven by local retail chain digitalization.,2019-Present
261,Technical Marketing Engineer (TME),"Creating technical content (benchmarks, white papers), supporting sales with deep product knowledge",Remote/Hybrid,4-7,"90,000 - 180,000",Bridging engineering and marketing for complex products.,2021-Present
262,Senior C# Developer (.NET Framework),"ASP.NET Web Forms/MVC (Legacy), SQL Server, Windows Communication Foundation (WCF)",On-site,6-10,"100,000 - 200,000",Maintenance and modification of mission-critical older systems.,2015-2020
263,IT Asset Management Specialist (ITAM),"Software License Optimization, Hardware Inventory Tracking, Policy Enforcement, Auditing",On-site,3-6,"60,000 - 110,000",Focus on cost savings and compliance for large organizations.,2018-Present
264,Quantitative Developer (FinTech/Algo Trading),"Python/C++, time-series data, low-latency coding, statistical modeling, financial markets knowledge",Remote,4-7,"150,000 - 350,000+","Highly niche, high-pay role, often for international clients.",2022-Present
265,IT Training Manager,"Curriculum development, managing a team of trainers, P&L responsibility for the training department",On-site,6+,"90,000 - 170,000",Leading internal or external corporate training programs.,2017-Present
266,Cloud Architect (Disaster Recovery/BDR),"Designing cross-region failover, backup automation, recovery process documentation, testing",Remote/Hybrid,7+,"160,000 - 320,000",Specialized in high availability and business continuity in the cloud.,2021-Present
267,Salesforce Developer (Apex/Lightning),"Apex, Visualforce (Legacy), Lightning Web Components (LWC), Integrations",Remote/Hybrid,4-7,"100,000 - 200,000",Focus on custom development and complex features.,2020-Present
268,BPO Quality Assurance Analyst (Voice),"Call monitoring, adherence to scripts/policy, scoring agent performance, feedback delivery",On-site,2-4,"40,000 - 65,000",Essential for maintaining service quality in call centers.,2015-Present
269,Senior UX Writer / Content Strategist,"Information Architecture, Tone of Voice guidelines, microcopy, error messages, user journeys",Remote,4-7,"70,000 - 130,000",Focus on clarity and consistency in product language.,2021-Present
270,Technical Lead (Mobile),"Leading iOS/Android teams, architecture decision-making, code reviews, performance tuning (Mobile focus)",Remote/Hybrid,7+,"140,000 - 280,000",Specializing in mobile application development leadership.,2019-Present
271,IT Strategy Consultant (Govt. Focus),"Advising ministries/agencies on digitalization, technology adoption roadmaps, policy review",On-site,10+,"200,000 - 450,000+",High-level advisory for large public sector projects.,2017-Present
272,Full-Stack Developer (MEAN Stack - Legacy),"MongoDB, Express, Angular (Legacy versions), Node.js, JavaScript",Remote/Hybrid,4-7,"70,000 - 140,000",Common in the mid-to-late 2010s for full-stack apps.,2016-2020
273,Game Developer (Unity/C#),"Unity Engine, C#, Game Physics, Asset Integration, Mobile Game Optimization",Remote/Hybrid,3-6,"60,000 - 120,000",Growth in local and international mobile gaming studios.,2019-Present
274,Data Governance Manager,"Leading data quality initiatives, defining data stewards, managing master data management (MDM)",On-site/Hybrid,6+,"120,000 - 250,000",Essential for compliance and leveraging data as a corporate asset.,2021-Present
275,Cloud DevOps Engineer (Terraform/Infrastructure as Code),"Terraform, Ansible/Chef/Puppet, Azure/AWS deployment automation, State management",Remote/Hybrid,4-7,"100,000 - 200,000",Focus on automating and versioning cloud infrastructure.,2020-Present
276,Junior Business Development Executive (ITES),"Researching potential clients (US/EU), cold email/LinkedIn outreach, setting up initial meetings",Remote,1-3,"30,000 - 50,000 (Plus Small Commission)",Entry-level role for firms expanding international footprint.,2018-Present
277,Robotics Process Automation (RPA) Business Analyst,"Identifying automation opportunities, calculating ROI, creating Process Design Documents (PDD)",On-site/Hybrid,3-6,"70,000 - 130,000",Bridging business needs with RPA capabilities.,2020-Present
278,Mid-Level Database Administrator (PostgreSQL),"PostgreSQL optimization, replication, backups, query tuning, PL/pgSQL",On-site/Hybrid,3-6,"60,000 - 120,000",Rising demand due to the popularity of open-source databases.,2018-Present
279,Mobile App Developer (Flutter/Dart),"Flutter Framework, Dart, Cross-platform development, State Management (Provider/Riverpod)",Remote/Hybrid,2-4,"55,000 - 100,000",High growth since 2020 due to development speed.,2020-Present
280,Technical Interviewer / Hiring Consultant,"Assessing candidate technical skills, designing interview rounds, specialized in a niche stack (e.g., Python/ML)",Remote,5+,"80,000 - 150,000 (Consultancy Fee Basis)",Consulting role for fast-growing companies that need hiring help.,2021-Present
281,SAP Basis Consultant,"SAP installation, patching, system monitoring, transport management system (TMS)",On-site/Hybrid,5-9,"130,000 - 280,000",Specialized infrastructure role for SAP customers.,2016-Present
282,IT Project Coordinator (Legacy/Waterfal),"Gantt Charts, Status Reporting, Budget tracking, strictly adherence to sequential methodology",On-site,3-5,"50,000 - 90,000",Used in traditional government or large infrastructure projects.,2015-2018
283,Cybersecurity Forensics Investigator,"Chain of custody, volatile data collection, forensic tools (EnCase, FTK), evidence analysis",On-site,5-8,"110,000 - 220,000",Niche role for responding to major security incidents.,2020-Present
284,Senior Data Analyst (SQL Mastery),"Complex nested SQL queries, stored procedures, data validation, performance optimization",Remote/Hybrid,5-8,"90,000 - 180,000",Deep technical role supporting core business intelligence.,2017-Present
285,Junior Cloud Engineer (Networking Focus),"Basic VPC/VNet setup, Firewall rules, Subnetting, Load Balancer configuration",On-site/Hybrid,1-3,"40,000 - 70,000",Entry point for traditional network admins moving to cloud.,2020-Present
286,Computer Graphics Programmer (VFX/Animation),"Python scripting (Maya/Blender), procedural content generation, rendering pipeline optimization",Remote,4-7,"80,000 - 160,000",Niche in local film/animation industry or international outsourcing.,2018-Present
287,Web Scraping Engineer (Legal/Ethical),"Advanced anti-ban techniques, large-scale data harvesting, compliance with terms of service",Remote,3-6,"70,000 - 130,000",Used by large market research and competitive intelligence firms.,2020-Present
288,Lead UI Designer (Atomic Design),"Defining the Atomic Design methodology, component states, documentation, design token usage",Remote/Hybrid,6+,"110,000 - 220,000","Focus on creating scalable, future-proof design systems.",2022-Present
289,IT Security Architect (Application),"Threat modeling (STRIDE), secure coding practices, DAST/SAST tool integration, secure SDLC",Remote/Hybrid,8+,"180,000 - 350,000",Designing security into the core application architecture.,2021-Present
290,Business Analyst (Digital Marketing Focus),"Gathering requirements for marketing automation, CRM integration, campaign tracking/reporting needs",Hybrid,3-6,"65,000 - 120,000",Focus on MarTech stack implementation.,2019-Present
291,"Desktop Support Technician (Field, L2)","Advanced OS/Hardware troubleshooting, network connectivity, Active Directory troubleshooting, ticket system management",On-site,3-5,"45,000 - 80,000",Requires ability to independently resolve issues.,2015-Present
292,Senior Python Developer (Data Science Focus),"Pandas, NumPy, Scikit-learn, ML model deployment (API), data wrangling",Remote/Hybrid,5-8,"120,000 - 240,000",Focus on productionizing machine learning models.,2020-Present
293,Technical Product Manager (Platform),"Managing APIs, internal tools, infrastructure products, backlog for engineering enablement",Remote/Hybrid,5-8,"110,000 - 220,000",Focus on internal technology and developer experience.,2021-Present
294,BPO Training Specialist (New Hire),"Onboarding new call center/data entry agents, soft skills training, process documentation",On-site,2-4,"40,000 - 70,000",Essential for rapid scaling of BPO operations.,2015-Present
295,Cloud Architect (Cost Optimization focus),"Reserved Instance/Savings Plan management, tagging strategies, resource rightsizing, budget alerting",Remote,5-8,"120,000 - 230,000",Strategic role focused purely on minimizing cloud spend.,2021-Present
296,System Integrator (Mid-level),"API management (e.g., Apigee), ESB/Middleware (e.g., Mulesoft), data transformation and mapping",On-site/Hybrid,3-6,"80,000 - 150,000",Essential for connecting diverse enterprise systems.,2017-Present
297,R&D Engineer (Telecommunication),"Researching new wireless standards (5G/6G), simulation tools (Matlab), patent generation",On-site,5-10,"150,000 - 300,000+",High-level research role in major telecom operators or vendors.,2018-Present
298,Full-Stack Developer (MERN/SaaS),"MongoDB, Express, React, Node.js, Stripe/Payment integration, multi-tenancy architecture",Remote/Hybrid,4-7,"90,000 - 180,000",High demand for building commercial Software-as-a-Service products.,2020-Present
299,IT Operations Director,"Overseeing all IT Infrastructure, Data Centers, Service Desk, Budgeting, and Team Management",On-site,12+,"250,000 - 500,000+",Executive-level leadership of the entire IT operation.,2015-Present
300,Academic Research Assistant (ICT),"Supporting Ph.D. students/Professors, data collection, literature review, basic statistical analysis",On-site,1-3,"30,000 - 50,000",Entry-level research role in university settings.,2015-Present
301,AI Prompt Engineer,"LLMs (GPT-4/Llama), Prompt Engineering, API Integration, Python, Creativity",Remote,2-5,"90,000 - 180,000",Focus on maximizing quality output from GenAI models.,
302,Cybersecurity Analyst (SOC L1),"SIEM Monitoring, Incident Triage, Log Analysis, Basic Networking (TCP/IP), Reporting",On-site (Night Shift),1-3,"45,000 - 80,000",Entry-level role in Security Operations Center.,2023-Present
303,HealthTech Product Manager,"Clinical Workflow Knowledge, EMR/EHR Systems, Healthcare Regulations, Agile/Scrum",Hybrid,5-9,"110,000 - 240,000",Niche role for digitizing local hospitals and clinics.,2020-Present
304,Senior Backend Developer (Rust/C++),"Rust or C++, High-performance Computing, Concurrency, Systems Programming",Remote,6+,"150,000 - 300,000+",Highly specialized for low-latency trading or blockchain.,2022-Present
305,Augmented Reality (AR) Developer,"Unity or Unreal Engine, C#/C++, Mobile AR (ARKit/ARCore), 3D Modeling basics",Remote/Hybrid,3-5,"70,000 - 140,000","Emerging in EdTech, retail, and gaming sectors.",2023-Present
306,FinOps Analyst,"Cloud Billing/Cost Management (AWS/Azure), Financial Modeling, Data Visualization (Power BI)",Remote,3-6,"80,000 - 150,000",Role focused entirely on cloud expenditure efficiency.,2021-Present
307,Junior Data Scientist (NLP Focus),"Python, NLTK/SpaCy, Transformers, Text Cleaning, Basic ML Algorithms",Remote,1-3,"45,000 - 85,000",Entry-level specialization in Natural Language Processing.,2022-Present
308,Senior Quality Assurance Lead (Performance),"JMeter/Gatling, Load Testing Strategy, Root Cause Analysis (APM tools), Mentorship",Hybrid,7+,"120,000 - 230,000",Focus on system stability under high load.,2021-Present
309,EdTech Instructional Designer,"Learning Management Systems (LMS), SCORM/xAPI, Graphic Design Tools, Adult Learning Theory",Remote/Hybrid,4-7,"60,000 - 110,000",Designing effective online courses and learning materials.,2019-Present
310,SAP FICO Consultant,"Financial Accounting (FI), Controlling (CO), Configuration, End-User Training",On-site,5-10,"150,000 - 350,000",High-value ERP specialization in Finance module.,2020-Present
311,Director of AI & ML,"Team Leadership, Research Strategy, Budget Management, Model Governance, MLOps",On-site/Hybrid,10+,"300,000 - 700,000+",Executive role driving the organization's AI adoption.,2015-Present
312,Full-Stack Developer (Ruby on Rails),"Ruby, Rails Framework, PostgreSQL/MySQL, JavaScript/jQuery (Legacy/Niche)",Remote/Hybrid,4-7,"80,000 - 160,000",Still used by international product companies and niche agencies.,2023-Present
313,Hardware/IoT Firmware Developer,"Embedded C/C++, Microcontrollers (Arduino/ESP32), Communication Protocols (MQTT/BLE)",On-site,3-6,"65,000 - 120,000",Required for local smart device manufacturing/R&D.,2016-Present
314,Senior DevOps Engineer (Security Focus),"DevSecOps, Static/Dynamic Analysis (SAST/DAST), Secrets Management (Vault), Pipeline Hardening",Remote,6+,"140,000 - 280,000",Integrating security throughout the CI/CD pipeline.,2019-Present
315,IT Auditor,"ISACA (CISA), IT General Controls (ITGC), Internal Audit Methodologies, Risk Assessment",On-site,4-7,"90,000 - 180,000","Ensuring controls are in place, especially in banks/FinTech.",2022-Present
316,Cloud Architect (Serverless/GCP Focus),"Google Cloud Functions, Cloud Run, BigQuery, Serverless design patterns",Remote,5-8,"130,000 - 250,000",Specialized in the Google Cloud ecosystem.,2017-Present
317,Digital Transformation Lead (Consulting),"Business Process Reengineering, Change Management, Technology Stack Selection, Stakeholder Management",On-site (Travel),8+,"200,000 - 400,000+",External consulting role driving major corporate changes.,2021-Present
318,UX Researcher (Qualitative/Quantitative),"User Interviews, Surveys, A/B Testing, Eye Tracking, Statistical Analysis (for quant.)",Remote/Hybrid,4-6,"70,000 - 130,000",Focus on evidence-based design decisions.,2019-Present
319,Junior Data Engineer (ETL),"SQL (Advanced), Basic Python, ETL Tools (Talend/Informatica), Data Warehousing basics",On-site,1-3,"40,000 - 75,000",Entry-level role building data pipelines.,2020-Present
320,Technical Writer (User Manuals/Help Docs),"MadCap Flare/Oxygen XML, Structured Content, Clear Prose, Technical Illustration",Remote/Hybrid,3-5,"50,000 - 90,000",Focused on end-user documentation and guides.,2018-Present
321,Data Scientist (Computer Vision),"OpenCV, Deep Learning (PyTorch/TensorFlow), Image Recognition, Object Detection",Remote,4-7,"120,000 - 250,000","Specialized in visual AI, used in security/manufacturing.",2015-Present
322,E-commerce Platform Architect (Magento),"Magento 2 (Advanced), PHP, Scalability, Payment Gateway Integration, CDN optimization",Remote,6+,"150,000 - 300,000",Highly paid specialization for large e-commerce platforms.,2022-Present
323,IT Support Specialist (International BPO),"English Fluency, Ticketing Systems (ServiceNow), Remote Desktop Support, Shift Work",Remote,2-4,"55,000 - 95,000",Servicing clients in the US/Europe/Australia.,2017-Present
324,Senior Frontend Developer (WebAssembly),"WebAssembly (Wasm), Rust/Go for Wasm, High-performance Web Graphics/Computation",Remote,5-8,"130,000 - 260,000","Niche, cutting-edge technology for web performance.",2016-Present
325,System Administrator (Linux/SRE Focus),"Red Hat/Ubuntu, Shell Scripting, Monitoring (Prometheus/Grafana), Automation (Ansible)",On-site/Hybrid,4-7,"90,000 - 180,000",Moving from traditional admin to Site Reliability Engineering (SRE).,2024-Present
326,Product Owner (AI/ML Focus),"Product Roadmap (ML), Feature Prioritization, LLM knowledge, Business Value realization",Remote/Hybrid,5-8,"120,000 - 240,000",Specializing in products driven by AI models.,2018-Present
327,Game Tester / QA (Manual),"Console/Mobile Testing, Bug Reporting (Jira/Trello), Test Case Execution, Attention to Detail",On-site,1-3,"30,000 - 50,000",Entry-level role in local game development studios.,2023-Present
328,Senior Full-Stack Developer (MERN/TypeScript),"MongoDB, Express, React, Node.js, TypeScript, Cloud Deployment",Remote/Hybrid,5-8,"110,000 - 210,000",Modern stack with a focus on type safety and scalability.,2019-Present
329,Digital Health Strategist (Govt.),"Public Health Policy, Interoperability Standards (HL7), Grant Management, Stakeholder Engagement",On-site,8+,"150,000 - 300,000+",High-level role driving national digital health initiatives.,2021-Present
330,Technical Account Manager (TAM),"Client Relationship Management, Technical Troubleshooting, Project Coordination, SLA adherence",Hybrid,4-7,"90,000 - 180,000",Post-sales role ensuring client technical success.,2020-Present
331,Senior Data Engineer (Airflow/Orchestration),"Apache Airflow, Data Pipeline Orchestration, Docker/Kubernetes, Data Quality Checks",Remote,6+,"140,000 - 280,000",Focus on scheduling and managing complex ETL workflows.,2018-Present
332,Blockchain Smart Contract Auditor,"Solidity, Ethereum/BNB Chain, Formal Verification Tools, Identifying Security Vulnerabilities (Reentrancy, etc.)",Remote,4-7,"150,000 - 350,000+","Highly specialized, high-pay security niche in Web3.",2021-Present
333,IT Instructor (Data Science/ML),"Teaching experience, Curriculum development, Python/R, Stats, Practical ML knowledge",On-site/Hybrid,3-6,"60,000 - 120,000",Required at bootcamps and universities.,2022-Present
334,Legacy Backend Developer (ColdFusion/Pascal),"Maintenance of highly specific, very old enterprise applications and databases",On-site,10+,"100,000 - 200,000",Extremely niche role in financial or large industrial sectors.,2018-Present
335,Cloud Security Specialist (AWS/Identity),"IAM, SSO, WAF/Security Groups, Compliance standards (HIPAA/PCI-DSS), Threat detection",Remote,5-8,"130,000 - 260,000",Focused on securing cloud environments and access.,2015-2017
336,IT Procurement Manager (Software/SaaS),"Licensing Agreements, Vendor Negotiation (Microsoft/Oracle), Budget Forecasting, Compliance",On-site/Hybrid,6+,"120,000 - 250,000",Focus on strategic sourcing of expensive software.,2020-Present
337,Junior Marketing Technologist (MarTech),"HubSpot/Salesforce Marketing Cloud, Basic HTML/CSS, Data Flows between Marketing Systems",Remote,1-3,"40,000 - 70,000",Bridging marketing strategy with technical tools.,2019-Present
338,Senior Full-Stack Developer (Go/React),"Golang, React/Redux, Microservices, Cloud Deployment (Docker/K8s)",Remote,6+,"140,000 - 280,000","High-performance, modern stack combining speed and flexibility.",2022-Present
339,Data Visualizer / Dashboard Specialist,"Tableau/Power BI/Looker Studio, SQL, Data Storytelling, User-centric Dashboard Design",Remote/Hybrid,3-5,"60,000 - 110,000",Focus on turning data insights into actionable visualizations.,2022-Present
340,Technical Sales Manager (B2B),"IT Services Sales, Solution Architecture, Proposal Writing, Client Presentation Skills",On-site/Hybrid,7+,"150,000 - 300,000 (Plus Commission)",High-stakes sales role targeting large enterprises.,2018-Present
341,RPA Technical Developer (Blue Prism/UiPath),"Advanced bot development, Orchestrator/Control Room management, Error handling framework",Remote/Hybrid,3-6,"80,000 - 160,000","Implementation of complex, resilient robotic processes.",2016-Present
342,Project Manager (Waterfall/Infrastructure),"Traditional PM skills, PMP Certification, managing hardware procurement, network deployment projects",On-site,5-9,"100,000 - 200,000","Found in organizations with rigid, fixed-scope projects.",2020-Present
343,Junior Frontend Developer (Bootstrap/jQuery),"HTML, CSS, JavaScript (basic), Bootstrap framework, website maintenance",On-site,1-2,"25,000 - 45,000",Maintaining small business/NGO websites. (Legacy role),2015-Present
344,AI/ML Researcher (Academic/Govt.),"Publication Record, Statistical Modeling, Grant Application, Collaboration with international universities",On-site,7+,"100,000 - 220,000",Focus on theoretical and applied research for public good.,2015-2018
