345,Cloud Architect (Kubernetes/EKS/AKS),"Advanced Kubernetes concepts, Helm, Service Mesh, Cluster Security/Scaling",Remote,6+,"150,000 - 300,000",Specialized role for container orchestration at scale.,2019-Present
346,IT Compliance Analyst (GDPR/Data Privacy),"Data Privacy Regulations (GDPR/CCPA), Data Mapping, Privacy by Design implementation, Auditing",Remote,4-7,"90,000 - 180,000",Essential for companies handling international user data.,2020-Present
347,Technical Writer (Security Focus),"Writing security vulnerability reports, runbooks for incident response, compliance documentation",Remote,4-6,"70,000 - 130,000",Specialization in high-stakes security communication.,2020-Present
348,Senior Full-Stack Developer (Python/Angular),"Python (Django/Flask), Angular (Modern), REST API design, Unit/Integration Testing",Remote/Hybrid,6+,"120,000 - 240,000",Robust enterprise stack combining stability and modern frontend.,2021-Present
349,UX/UI Designer (Figma/Prototyping),"Figma/Sketch, Prototyping (Interaction Design), Wireframing, User-Centered Design Principles",Remote/Hybrid,2-4,"50,000 - 90,000",Standard modern UI/UX role.,2017-Present
350,IT Service Management (ITSM) Specialist,"ITIL Certification, Service Catalogue Management, Process Improvement, Change/Incident Management tools",On-site/Hybrid,5-8,"100,000 - 190,000",Focus on improving and managing IT service delivery.,2018-Present
351,Enterprise Resource Planning (ERP),"SAP S/4HANA, FICO/MM Module, ABAP",Urban Center,7,"185,000","SAP Certification, Stakeholder Management",
352,Cloud Solution Architecture,"AWS/Azure Architecture, Hybrid Cloud, FinOps",Urban Center,10,"250,000","Certified Cloud Architect, Business Strategy",T4
353,DevOps Engineering,"Kubernetes, Azure DevOps, Terraform, GitOps",Remote,6,"170,000","CI/CD pipeline specialization, Security focus",T4
354,Data Engineering,"Spark, Databricks, ETL, Data Warehousing (DW)",Urban Center,4,"105,000","Airflow orchestration, Scala/Python",T4
355,Security Consulting,"DevSecOps, Penetration Testing, Risk Assessment",Urban Center,5,"160,000","CISSP/CISM, ISO 27001, Consulting Experience",T4
356,Product Management,"SaaS, Agile/Scrum, User Story Mapping, UX/UI",Urban Center,8,"195,000","Technology background, Market Analysis",T4
357,LLM Engineer,"Generative AI, Hugging Face, Fine-tuning Models",Urban Center,3,"210,000","Deep Learning Frameworks, NLP Research",T4
358,Quantum Computing,"Qiskit/Cirq, Linear Algebra, Quantum Algorithms",Virtual/MNC,5,"280,000","Theoretical Physics background, Research papers",T5
359,Bio-informatics Data Science,"Genomic Data, Python (Biopython), Statistical Modeling",Urban Center,6,"155,000","Molecular Biology knowledge, High-Performance Computing",T5
360,AR/VR Developer,"Unity/Unreal Engine, C#, 3D Modeling",Urban Center,4,"95,000","Portfolio of immersive projects, UX/Interaction Design",T5
361,Chief Information Security Officer (CISO),"Enterprise Security Strategy, GRC, Crisis Management",Urban Center,15,"400,000","PhD/MBA, Extensive regulatory compliance",T5
362,Cloud Security Architect,"AWS/Azure/GCP Security, Compliance Automation",Urban Center,8,"230,000","CCSP/AWS Security Specialty, Threat Modeling",T4
363,"Governance, Risk, & Compliance (GRC) Analyst","IT Audit, NIST/ISO Frameworks, Policy Implementation",Urban Center,4,"115,000","CISA/CGEIT, Excellent report writing",T4
364,SAP Basis Administrator,"SAP HANA DB, System Monitoring, OS/DB Migration",Urban Center,5,"135,000","Unix/Linux, Disaster Recovery Planning",T4
365,ERP Functional Consultant,"Oracle e-Business Suite (SCM), Process Mapping",Urban Center,6,"150,000","Strong business process acumen, Supply Chain focus",T4
366,Database Administrator (DBA) - Senior,"PostgreSQL/NoSQL, Performance Tuning, Scaling",Urban Center,8,"165,000","Replication strategies, Cloud database services",T4
367,Edge Computing Engineer,"IoT/Sensor Data, Microservices, Low-latency Networking",Urban Center,4,"140,000","Telecommunication background, MQTT Protocol",T4
368,Generative AI Content Specialist,"Prompt Engineering, Content Strategy, Midjourney/DALL-E",Remote,3,"85,000","Creative Writing, Data Visualization",T5
369,Site Reliability Engineer (SRE),"Chaos Engineering, Observability Tools (Prometheus/Grafana)",Urban Center,7,"180,000","Automation Scripting (Python/Go), Incident Response",T5
370,Robotics Process Automation (RPA) Developer,"UiPath/Blue Prism, Process Documentation",Urban Center,3,"90,000","Business Analysis, Financial Services domain",T4
371,MEAL & KM Officer (NGO),"M&E Systems, Data Analysis (Stata/R), Knowledge Management",Regional Town,5,"65,000","Development Sector experience, Field Data Collection",T4
372,ICT Co-Trainer (NGO Project),"Basic Computer Literacy, Android Applications, Training",Rural,2,"35,000","Strong communication, Local language proficiency",T3
373,Project Coordinator (Data Systems),"Project Management, Donor Reporting, MIS Implementation",Urban Center,7,"95,000","PMP/PRINCE2, Experience with UN/International Donor",T3
374,Data Mobilization Specialist,"Mobile Data Collection (ODK/Kobo), GIS Mapping",Regional Town,3,"55,000","Community engagement, GPS/Mapping tools",T3
375,IT Support Specialist (NGO Field Office),"Hardware/Networking Troubleshooting, Helpdesk",Rural,4,"45,000","Basic Server Administration, VSAT/Remote comms",T3
376,GIS Data Manager (LGED),"ArcGIS, Spatial Database, Urban Planning Data",Urban Center,6,"75,000","Cartography, Civil Engineering/Surveying background",T3
377,System Analyst (Public Health),"Health MIS, Data Standards (HL7/FHIR), Requirement Analysis",Urban Center,5,"85,000","Public Health background, Government liaison",T3
378,Steno-Typist-cum-Computer Operator (Govt),"Typing (Bangla/English), File Management, Basic MS Office",Urban Center,10,"40,000","High typing speed, Confidentiality",T3
379,Computer Operator (Municipal Corp.),"Data Entry, Record Keeping (Digital & Paper)",Regional Town,3,"30,000","Basic hardware maintenance, 2015-era role",T2
380,Senior Network Engineer (ISP),"BGP/OSPF, Cisco/MikroTik, Network Security",Urban Center,8,"130,000","CCIE/JNCIE certification, Telecom tower comms",T1
381,Full Stack Developer (FinTech),"MERN/MEAN Stack, Security Best Practices, Payment Gateway",Urban Center,5,"160,000","Microservices, High-availability architecture",T4
382,Cybersecurity Analyst (Entry-Level),"SIEM Monitoring, Incident Triage, Vulnerability Scanning",Urban Center,1,"55,000","Security+/CEH, Scripting (Bash/Python)",T4
383,Digital Transformation Lead,"Change Management, Business Process Re-engineering, Cloud",Urban Center,12,"260,000","MBA/Executive Education, Cross-functional leadership",T4
384,UX/UI Designer,"Figma/Sketch, Design Thinking, User Research",Urban Center,4,"90,000","Prototyping, A/B Testing",T4
385,Mobile App Developer (iOS/Swift),"iOS SDK, Native App Development, Push Notifications",Urban Center,6,"140,000","Performance optimization, App Store deployment",T2
386,Cloud DevOps Engineer (Associate),"Docker, CI/CD, Scripting (Python), Basic Cloud Services",Urban Center,2,"65,000","Cloud certification (associate level), Version Control",T2
387,Legacy System Developer (2015),"COBOL/Fortran, Mainframe, System Maintenance",Urban Center,15,"120,000","Banking/Insurance sector experience, Deep institutional knowledge",T4
388,Blockchain Developer,"Smart Contracts (Solidity), Ethereum/Hyperledger, Cryptography",Urban Center,4,"175,000","DeFi/FinTech focus, Security Auditing",T1
389,IoT Platform Engineer,"M2M Communication, Sensor Integration, Data Stream Processing",Urban Center,6,"150,000","Real-time analytics, Industrial IoT (IIoT)",T5
390,Technical Writer,"API Documentation, Confluence/Jira, Software Development Lifecycle",Remote,3,"50,000","Excellent English proficiency, Markdown/REST API",T5
391,E-commerce Manager (Tech Focus),"Shopify/WooCommerce, Digital Marketing (SEO/PPC), Analytics",Urban Center,5,"110,000",Inventory Management Systems integration,T2
392,Web Designer (2015 Role),"HTML, CSS, Photoshop, Basic JavaScript",Regional Town,3,"35,000","Focus on static sites, Browser compatibility",T3
393,Junior Frontend Developer,"React/Vue/Angular, Responsive Design, State Management",Urban Center,1,"45,000","Strong portfolio, Git usage",T1
394,Data Entry Specialist (Remote),"High WPM, Data Accuracy, MS Excel/Google Sheets",Remote,2,"28,000","Attention to detail, Time management",T2
395,IT Helpdesk Technician,"Windows/Linux Support, Ticketing System, Remote Assistance",Urban Center,2,"40,000","Customer service skills, Hardware/Software repair",T2
396,Senior QA Engineer,"Automated Testing (Selenium/Cypress), Performance Testing",Urban Center,7,"125,000","Test Strategy Definition, Mentorship",T1
397,System Administrator (On-Premises),"Active Directory, Windows Server, Virtualization (VMware)",Urban Center,5,"95,000","Backup/Recovery Solutions, PowerShell scripting",T2
398,Technical Sales Engineer,"Product Demos, Pre-sales Consulting, IT Solution selling",Urban Center,4,"115,000","Excellent presentation skills, Technical depth",T1
399,Senior Software Engineer (2020),"Java/Spring Boot, Relational Databases, Agile Methodology",Urban Center,7,"130,000","Code review, System architecture knowledge",T3
400,Junior MLOps Engineer,"Kubeflow/MLflow, Cloud Deployment (SageMaker/Vertex AI)",Urban Center,1,"75,000","Containerization (Docker), Python ecosystem",T2
,,,,,,,T5